{
  "schema_version": "1.0",
  "generated_from": [
    "config/reference_catalog.json",
    "config/template_design_dna.json",
    "assets/slides/library/*/metadata/*.json"
  ],
  "nodes": [
    {
      "id": "audience:analytical",
      "type": "audience",
      "label": "analytical"
    },
    {
      "id": "audience:conservative",
      "type": "audience",
      "label": "conservative"
    },
    {
      "id": "audience:executive",
      "type": "audience",
      "label": "executive"
    },
    {
      "id": "audience:portfolio",
      "type": "audience",
      "label": "portfolio"
    },
    {
      "id": "audience:sales",
      "type": "audience",
      "label": "sales"
    },
    {
      "id": "audience:technical",
      "type": "audience",
      "label": "technical"
    },
    {
      "id": "category:analysis",
      "type": "category",
      "label": "analysis"
    },
    {
      "id": "category:chart",
      "type": "category",
      "label": "chart"
    },
    {
      "id": "category:closing",
      "type": "category",
      "label": "closing"
    },
    {
      "id": "category:cover",
      "type": "category",
      "label": "cover"
    },
    {
      "id": "category:general",
      "type": "category",
      "label": "general"
    },
    {
      "id": "category:issue",
      "type": "category",
      "label": "issue"
    },
    {
      "id": "category:market",
      "type": "category",
      "label": "market"
    },
    {
      "id": "category:process",
      "type": "category",
      "label": "process"
    },
    {
      "id": "category:strategy",
      "type": "category",
      "label": "strategy"
    },
    {
      "id": "category:summary",
      "type": "category",
      "label": "summary"
    },
    {
      "id": "category:team",
      "type": "category",
      "label": "team"
    },
    {
      "id": "category:timeline",
      "type": "category",
      "label": "timeline"
    },
    {
      "id": "category:toc",
      "type": "category",
      "label": "toc"
    },
    {
      "id": "deck_type:generic",
      "type": "deck_type",
      "label": "generic"
    },
    {
      "id": "deck_type:portfolio",
      "type": "deck_type",
      "label": "portfolio"
    },
    {
      "id": "deck_type:report",
      "type": "deck_type",
      "label": "report"
    },
    {
      "id": "deck_type:sales",
      "type": "deck_type",
      "label": "sales"
    },
    {
      "id": "layout:comparison",
      "type": "layout",
      "label": "comparison"
    },
    {
      "id": "layout:dense",
      "type": "layout",
      "label": "dense"
    },
    {
      "id": "layout:grid",
      "type": "layout",
      "label": "grid"
    },
    {
      "id": "layout:light",
      "type": "layout",
      "label": "light"
    },
    {
      "id": "layout:medium",
      "type": "layout",
      "label": "medium"
    },
    {
      "id": "layout:metric",
      "type": "layout",
      "label": "metric"
    },
    {
      "id": "layout:process",
      "type": "layout",
      "label": "process"
    },
    {
      "id": "layout:story",
      "type": "layout",
      "label": "story"
    },
    {
      "id": "layout:timeline",
      "type": "layout",
      "label": "timeline"
    },
    {
      "id": "production_template:template_library_01_v1.channel_cover_v1",
      "type": "production_template",
      "label": "template_library_01_v1.channel_cover_v1",
      "purpose": "cover",
      "scope": "sales"
    },
    {
      "id": "production_template:template_library_01_v1.data_method_v1",
      "type": "production_template",
      "label": "template_library_01_v1.data_method_v1",
      "purpose": "process",
      "scope": "sales"
    },
    {
      "id": "production_template:template_library_01_v1.discussion_closing_v1",
      "type": "production_template",
      "label": "template_library_01_v1.discussion_closing_v1",
      "purpose": "closing",
      "scope": "sales"
    },
    {
      "id": "production_template:template_library_01_v1.expansion_story_v1",
      "type": "production_template",
      "label": "template_library_01_v1.expansion_story_v1",
      "purpose": "strategy",
      "scope": "sales"
    },
    {
      "id": "production_template:template_library_01_v1.partnership_goal_v1",
      "type": "production_template",
      "label": "template_library_01_v1.partnership_goal_v1",
      "purpose": "closing",
      "scope": "sales"
    },
    {
      "id": "production_template:template_library_01_v1.pilot_program_v1",
      "type": "production_template",
      "label": "template_library_01_v1.pilot_program_v1",
      "purpose": "process",
      "scope": "sales"
    },
    {
      "id": "production_template:template_library_01_v1.prioritization_metric_v1",
      "type": "production_template",
      "label": "template_library_01_v1.prioritization_metric_v1",
      "purpose": "analysis",
      "scope": "sales"
    },
    {
      "id": "production_template:template_library_01_v1.sales_strategy_steps_v1",
      "type": "production_template",
      "label": "template_library_01_v1.sales_strategy_steps_v1",
      "purpose": "strategy",
      "scope": "sales"
    },
    {
      "id": "production_template:template_library_01_v1.service_intro_cards_v1",
      "type": "production_template",
      "label": "template_library_01_v1.service_intro_cards_v1",
      "purpose": "summary",
      "scope": "sales"
    },
    {
      "id": "production_template:template_library_01_v1.service_model_v1",
      "type": "production_template",
      "label": "template_library_01_v1.service_model_v1",
      "purpose": "process",
      "scope": "sales"
    },
    {
      "id": "production_template:template_library_02_v1.alpha_signal_timeline_v1",
      "type": "production_template",
      "label": "template_library_02_v1.alpha_signal_timeline_v1",
      "purpose": "strategy",
      "scope": "sales"
    },
    {
      "id": "production_template:template_library_02_v1.before_after_compare_v1",
      "type": "production_template",
      "label": "template_library_02_v1.before_after_compare_v1",
      "purpose": "analysis",
      "scope": "sales"
    },
    {
      "id": "production_template:template_library_02_v1.core_technology_v1",
      "type": "production_template",
      "label": "template_library_02_v1.core_technology_v1",
      "purpose": "analysis",
      "scope": "sales"
    },
    {
      "id": "production_template:template_library_02_v1.finance_closing_v1",
      "type": "production_template",
      "label": "template_library_02_v1.finance_closing_v1",
      "purpose": "closing",
      "scope": "sales"
    },
    {
      "id": "production_template:template_library_02_v1.finance_cover_v1",
      "type": "production_template",
      "label": "template_library_02_v1.finance_cover_v1",
      "purpose": "cover",
      "scope": "sales"
    },
    {
      "id": "production_template:template_library_02_v1.poc_process_v1",
      "type": "production_template",
      "label": "template_library_02_v1.poc_process_v1",
      "purpose": "process",
      "scope": "sales"
    },
    {
      "id": "production_template:template_library_02_v1.problem_story_v1",
      "type": "production_template",
      "label": "template_library_02_v1.problem_story_v1",
      "purpose": "issue",
      "scope": "sales"
    },
    {
      "id": "production_template:template_library_02_v1.proof_metrics_v1",
      "type": "production_template",
      "label": "template_library_02_v1.proof_metrics_v1",
      "purpose": "chart",
      "scope": "sales"
    },
    {
      "id": "production_template:template_library_02_v1.roi_threepillars_v1",
      "type": "production_template",
      "label": "template_library_02_v1.roi_threepillars_v1",
      "purpose": "analysis",
      "scope": "sales"
    },
    {
      "id": "production_template:template_library_02_v1.service_components_v1",
      "type": "production_template",
      "label": "template_library_02_v1.service_components_v1",
      "purpose": "summary",
      "scope": "sales"
    },
    {
      "id": "production_template:template_library_02_v1.signal_speed_v1",
      "type": "production_template",
      "label": "template_library_02_v1.signal_speed_v1",
      "purpose": "chart",
      "scope": "sales"
    },
    {
      "id": "production_template:template_library_02_v1.vertical_use_cases_v1",
      "type": "production_template",
      "label": "template_library_02_v1.vertical_use_cases_v1",
      "purpose": "analysis",
      "scope": "sales"
    },
    {
      "id": "production_template:template_library_03_v1.improvement_case_v1",
      "type": "production_template",
      "label": "template_library_03_v1.improvement_case_v1",
      "purpose": "analysis",
      "scope": "portfolio"
    },
    {
      "id": "production_template:template_library_03_v1.org_initiative_case_v1",
      "type": "production_template",
      "label": "template_library_03_v1.org_initiative_case_v1",
      "purpose": "analysis",
      "scope": "portfolio"
    },
    {
      "id": "production_template:template_library_03_v1.patent_case_v1",
      "type": "production_template",
      "label": "template_library_03_v1.patent_case_v1",
      "purpose": "analysis",
      "scope": "portfolio"
    },
    {
      "id": "production_template:template_library_03_v1.portfolio_closing_v1",
      "type": "production_template",
      "label": "template_library_03_v1.portfolio_closing_v1",
      "purpose": "closing",
      "scope": "portfolio"
    },
    {
      "id": "production_template:template_library_03_v1.portfolio_cover_v1",
      "type": "production_template",
      "label": "template_library_03_v1.portfolio_cover_v1",
      "purpose": "cover",
      "scope": "portfolio"
    },
    {
      "id": "production_template:template_library_03_v1.profile_resume_v1",
      "type": "production_template",
      "label": "template_library_03_v1.profile_resume_v1",
      "purpose": "team",
      "scope": "portfolio"
    },
    {